topic,source
quantum computing,What is quantum computing and how does it work?
artificial intelligence,Explain the difference between machine learning and deep learning
climate change,What are the main causes of global warming?
space exploration,Why is Mars exploration important for humanity?
renewable energy,What are the advantages of solar power over fossil fuels?
blockchain,How does blockchain technology ensure security?
gene editing,What is CRISPR and how is it used in medicine?
virtual reality,What are the applications of VR in education?
cybersecurity,How can individuals protect their data online?
autonomous vehicles,What are the challenges facing self-driving cars?